[
  {
    "id": "voice-be-1",
    "locale": "be",
    "narrator_credit": "Сінтэтычны дэма-голас",
    "character": "Дракон"
  },
  {
    "id": "voice-en-1",
    "locale": "en",
    "narrator_credit": "Synthetic demo voice",
    "character": "The Dragon"
  },
  {
    "id": "voice-uk-1",
    "locale": "uk",
    "narrator_credit": "Синтетичний демо-голос",
    "character": "Дракон"
  }
]
